{
  "schema_version": "rl-engineering-config-v1",
  "step": 27,
  "research_status": "synthetic_validation_only_non_research",
  "algorithm": "categorical_ppo",
  "algorithm_status": "engineering_candidate_not_frozen_research_field",
  "training_seeds": [27, 127, 227, 327, 427],
  "train_episodes_per_update": 20,
  "updates": 10,
  "steps_per_episode": 12,
  "parent_lots": 100,
  "gamma": 0.99,
  "gae_lambda": 0.95,
  "clip_ratio": 0.2,
  "entropy_coef": 0.01,
  "value_coef": 0.5,
  "learning_rate": 0.001,
  "update_epochs": 4,
  "hidden_units": 32,
  "inventory_penalty_bps": 3.0,
  "invalid_action_penalty_bps": 25.0,
  "terminal_impact_multiplier": 2.0,
  "evaluation_episodes": 40,
  "ood_episodes": 50,
  "seed": 2700
}
